sseqid,start location,end location,strand,percent identity,full length of feature in db,length of found feature,percent match length,fragment,database,Feature,Type,Description,sequence
P06855,2029,2932,1,100.0,903,903,100.0,False,swissprot,pseT,CDS,"KIPN_BPT4 - Experimental evidence at protein level: Swiss-Prot protein existence level 1. Acts as a 5'-hydroxyl kinase, a 3'-phosphatase and a 2',3'- cyclic phosphodiesterase. Catalyzes the transfer of the terminal phosphate of ATP to the 5'-hydroxyl termini of ribo- and deoxyribonucleotides. In the presence of ADP the enzyme also catalyzes an exchange reaction. In the exchange reaction, an excess ADP causes the enzyme to transfer the 5' terminal phosphate from phosphorylated DNA to ADP (PubMed:5323016, PubMed:199248). Involved in countering a host defense mechanism which activates T4-induced anticodon nuclease and shuts off viral translation. The polynucleotide kinase modifies the ends of nicked tRNA generated by the antiviral response of the host bacteria and facilitates repair by T4 RNA ligase (PubMed:2444436). From Enterobacteria phage T4 (Bacteriophage T4).",ATGAAAAAGATCATCCTGACTATCGGTTGCCCGGGTTCCGGCAAATCTACCTGGGCACGTGAGTTCATCGCTAAAAACCCAGGTTTCTATAACATCAACCGCGATGATTACCGTCAGTCTATTATGGCTCACGAAGAACGCGATGAATACAAATACACTAAAAAAAAAGAAGGTATCGTCACCGGTATGCAGTTCGATACTGCCAAGTCTATCCTGTACGGCGGTGATTCCGTTAAAGGCGTCATCATCTCCGACACGAACCTGAACCCAGAGCGCCGCCTGGCGTGGGAAACGTTCGCTAAAGAGTATGGTTGGAAAGTTGAGCACAAAGTGTTTGATGTACCGTGGACCGAACTGGTAAAACGTAACTCTAAACGTGGTACCAAAGCAGTTCCAATCGATGTTCTGCGCTCCATGTACAAATCCATGCGCGAATACCTGGGCCTGCCGGTTTACAATGGCACCCCGGGCAAGCCGAAGGCCGTCATCTTCGACGTTGACGGCACCCTGGCAAAGATGAACGGCCGTGGTCCGTACGATCTGGAAAAATGTGACACCGACGTAATTAACCCGATGGTCGTTGAACTGTCCAAGATGTATGCCCTGATGGGTTACCAGATCGTTGTTGTTTCTGGTCGTGAGTCTGGTACTAAGGAAGATCCGACTAAGTATTACCGTATGACGCGTAAATGGGTCGAAGATATCGCTGGTGTTCCACTGGTAATGCAGTGCCAACGCGAACAGGGCGACACCCGTAAAGATGACGTTGTAAAAGAAGAAATCTTTTGGAAACACATTGCACCGCACTTCGACGTGAAATTGGCGATTGACGACCGTACCCAGGTGGTAGAAATGTGGCGTCGCATTGGCGTAGAGTGCTGGCAGGTTGCGTCTGGTGATTTT
AmpR_promoter_(4),1812,1917,-1,100.0,105,105,100.0,False,snapgene,AmpR promoter,promoter,bla,CGCGGAACCCCTATTTGTTTATTTTTCTAAATACATTCAAATATGTATCCGCTCATGAGACAATAACCCTGATAAATGCTTCAATAATATTGAAAAAGGAAGAGT
AmpR_(2),951,1812,-1,99.652,861,861,100.0,False,snapgene,AmpR,CDS,"β-lactamase; bla; confers resistance to ampicillin, carbenicillin, and related antibiotics",ATGAGTATTCAACATTTCCGTGTCGCCCTTATTCCCTTTTTTGCGGCATTTTGCCTTCCTGTTTTTGCTCACCCAGAAACGCTGGTGAAAGTAAAAGATGCTGAAGATCAGTTGGGTGCACGAGTGGGTTACATCGAACTGGATCTCAACAGCGGTAAGATCCTTGAGAGTTTTCGCCCCGAAGAACGTTTTCCAATGATGAGCACTTTTAAAGTTCTGCTATGTGGCGCGGTATTATCCCGTATTGACGCCGGGCAAGAGCAACTCGGTCGCCGCATACACTATTCTCAGAATGACTTGGTTGAGTACTCACCAGTCACAGAAAAGCATCTTACGGATGGCATGACAGTAAGAGAATTATGCAGTGCTGCCATAACCATGAGTGATAACACTGCGGCCAACTTACTTCTGACAACGATCGGAGGACCGAAGGAGCTAACCGCTTTTTTGCACAACATGGGGGATCATGTAACTCGCCTTGATCGTTGGGAACCGGAGCTGAATGAAGCCATACCAAACGACGAGCGTGACACCACGATGCCTGTAGCAATGGCAACAACGTTGCGCAAACTATTAACTGGCGAACTACTTACTCTAGCTTCCCGGCAACAATTAATAGACTGGATGGAGGCGGATAAAGTTGCAGGACCACTTCTGCGCTCGGCCCTTCCGGCTGGCTGGTTTATTGCTGATAAATCTGGAGCCGGTGAGCGTGGTTCTCGCGGTATCATTGCAGCACTGGGGCCAGATGGTAAGCCCTCCCGTATCGTAGTTATCTACACGACGGGGAGTCAGGCAACTATGGATGAACGAAATAGACAGATCGCTGAGATAGGTGCCTCACTGATTAAGCATTGGTAA
ori,172,761,-1,99.83,589,589,100.0,False,snapgene,ori,rep_origin,high-copy-number ColE1/pMB1/pBR322/pUC origin of replication ,TTGAGATCCTTTTTTTCTGCGCGTAATCTGCTGCTTGCAAACAAAAAAACCACCGCTACCAGCGGTGGTTTGTTTGCCGGATCAAGAGCTACCAACTCTTTTTCCGAAGGTAACTGGCTTCAGCAGAGCGCAGATACCAAATACTGTTCTTCTAGTGTAGCCGTAGTTAGGCCACCACTTCAAGAACTCTGTAGCACCGCCTACATACCTCGCTCTGCTAATCCTGTTACCAGTGGCTGCTGCCAGTGGCGATAAGTCGTGTCTTACCGGGTTGGACTCAAGACGATAGTTACCGGATAAGGCGCAGCGGTCGGGCTGAACGGGGGGTTCGTGCACACAGCCCAGCTTGGAGCGAACGACCTACACCGAACTGAGATACCTACAGCGTGAGCTATGAGAAAGCGCCACGCTTCCCGAAGGGAGAAAGGCGGACAGGTATCCGGTAAGCGGCAGGGTCGGAACAGGAGAGCGCACGAGGGAGCTTCCAGGGGGAAACGCCTGGTATCTTTATAGTCCTGTCGGGTTTCGCCACCTCTGACTTGAGCGTCGATTTTTGTGATGCTCGTCAGGGGGGCGGAGCCTATGGAAA
T7_terminator,37,85,1,100.0,48,48,100.0,False,snapgene,T7 terminator,terminator,transcription terminator for bacteriophage T7 RNA polymerase,CTAGCATAACCCCTTGGGGCCTCTAAACGGGTCTTGAGGGGTTTTTTG
tonB_terminator,1949,1981,1,100.0,32,32,100.0,False,snapgene,tonB terminator,terminator,bidirectional E. coli tonB-P14 transcription terminator,AGTCAAAAGCCTCCGACCGGAGGCTTTTGACT
1,615,720,1,100.0,102,105,97.05882352941177,False,Rfam,RNAI,ncRNA,Accession: RF00106 - RNAI,AGTATTTGGTATCTGCGCTCTGCTGAAGCCAGTTACCTTCGGAAAAAGAGTTGGTAGCTCTTGATCCGGCAAACAAACCACCGCTGGTAGCGGTGGTTTTTTTGT
lacZ_alpha,1932,1949,-1,100.0,174,17,9.770114942528735,True,snapgene,lacZα,CDS,LacZα fragment of β-galactosidase; lacZ fragment,ACTGGCCGTCGTTTTAC
