sseqid,start location,end location,strand,percent identity,full length of feature in db,length of found feature,percent match length,fragment,database,Feature,Type,Description,sequence
AmpR_promoter_(4),1812,1917,-1,100.0,105,105,100.0,False,snapgene,AmpR promoter,promoter,bla,CGCGGAACCCCTATTTGTTTATTTTTCTAAATACATTCAAATATGTATCCGCTCATGAGACAATAACCCTGATAAATGCTTCAATAATATTGAAAAAGGAAGAGT
P04418,2029,2443,1,100.0,414,414,100.0,False,swissprot,END5_BPT4,CDS,Experimental evidence at protein level: Swiss-Prot protein existence level 1. Participates in the repair of UV-damaged DNA by excising pyrimidine dimers that are the major UV-lesions (PubMed:6254991). DNA glycosylase activity hydrolyzes the glycosylic bond of the 5' pyrimidine of the dimer (PubMed:6254991). This leaves apurinic/apyrimidic (AP) sites in the DNA. These AP sites are removed by the AP lyase activity which cleaves the intrapyrimidine phosphodiester bond (PubMed:6254991). Catalysis proceeds via a protonated imine covalent intermediate between the alpha-amino group of the N-terminal threonine residue and the C1' of the deoxyribose sugar of the 5' pyrimidine at the dimer site (PubMed:8347626) (PubMed:16916523). From Enterobacteria phage T4 (Bacteriophage T4).,ATGACGCGTATCAACCTGACTCTGGTTAGCGAATTGGCTGATCAGCACCTGATGGCAGAGTATCGTGAACTGCCGCGTGTATTCGGTGCTGTTCGTAAACACGTTGCAAATGGTAAACGTGTTCGTGATTTTAAGATCAGCCCGACGTTCATCTTGGGTGCTGGTCACGTAACTTTCTTTTACGATAAACTGGAGTTCCTCCGTAAGCGTCAGATCGAACTGATTGCTGAATGCCTGAAACGTGGCTTCAACATCAAGGACACCACGGTGCAGGATATCTCTGACATTCCGCAGGAGTTCCGTGGTGACTACATTCCGCACGAAGCCTCCATCGCCATTTCCCAGGCTCGTCTGGACGAAAAAATTGCCCAGCGTCCAACCTGGTATAAATACTACGGCAAAGCTATCTACGCC
AmpR_(2),951,1812,-1,99.652,861,861,100.0,False,snapgene,AmpR,CDS,"β-lactamase; bla; confers resistance to ampicillin, carbenicillin, and related antibiotics",ATGAGTATTCAACATTTCCGTGTCGCCCTTATTCCCTTTTTTGCGGCATTTTGCCTTCCTGTTTTTGCTCACCCAGAAACGCTGGTGAAAGTAAAAGATGCTGAAGATCAGTTGGGTGCACGAGTGGGTTACATCGAACTGGATCTCAACAGCGGTAAGATCCTTGAGAGTTTTCGCCCCGAAGAACGTTTTCCAATGATGAGCACTTTTAAAGTTCTGCTATGTGGCGCGGTATTATCCCGTATTGACGCCGGGCAAGAGCAACTCGGTCGCCGCATACACTATTCTCAGAATGACTTGGTTGAGTACTCACCAGTCACAGAAAAGCATCTTACGGATGGCATGACAGTAAGAGAATTATGCAGTGCTGCCATAACCATGAGTGATAACACTGCGGCCAACTTACTTCTGACAACGATCGGAGGACCGAAGGAGCTAACCGCTTTTTTGCACAACATGGGGGATCATGTAACTCGCCTTGATCGTTGGGAACCGGAGCTGAATGAAGCCATACCAAACGACGAGCGTGACACCACGATGCCTGTAGCAATGGCAACAACGTTGCGCAAACTATTAACTGGCGAACTACTTACTCTAGCTTCCCGGCAACAATTAATAGACTGGATGGAGGCGGATAAAGTTGCAGGACCACTTCTGCGCTCGGCCCTTCCGGCTGGCTGGTTTATTGCTGATAAATCTGGAGCCGGTGAGCGTGGTTCTCGCGGTATCATTGCAGCACTGGGGCCAGATGGTAAGCCCTCCCGTATCGTAGTTATCTACACGACGGGGAGTCAGGCAACTATGGATGAACGAAATAGACAGATCGCTGAGATAGGTGCCTCACTGATTAAGCATTGGTAA
ori,172,761,-1,99.83,589,589,100.0,False,snapgene,ori,rep_origin,high-copy-number ColE1/pMB1/pBR322/pUC origin of replication ,TTGAGATCCTTTTTTTCTGCGCGTAATCTGCTGCTTGCAAACAAAAAAACCACCGCTACCAGCGGTGGTTTGTTTGCCGGATCAAGAGCTACCAACTCTTTTTCCGAAGGTAACTGGCTTCAGCAGAGCGCAGATACCAAATACTGTTCTTCTAGTGTAGCCGTAGTTAGGCCACCACTTCAAGAACTCTGTAGCACCGCCTACATACCTCGCTCTGCTAATCCTGTTACCAGTGGCTGCTGCCAGTGGCGATAAGTCGTGTCTTACCGGGTTGGACTCAAGACGATAGTTACCGGATAAGGCGCAGCGGTCGGGCTGAACGGGGGGTTCGTGCACACAGCCCAGCTTGGAGCGAACGACCTACACCGAACTGAGATACCTACAGCGTGAGCTATGAGAAAGCGCCACGCTTCCCGAAGGGAGAAAGGCGGACAGGTATCCGGTAAGCGGCAGGGTCGGAACAGGAGAGCGCACGAGGGAGCTTCCAGGGGGAAACGCCTGGTATCTTTATAGTCCTGTCGGGTTTCGCCACCTCTGACTTGAGCGTCGATTTTTGTGATGCTCGTCAGGGGGGCGGAGCCTATGGAAA
T7_terminator,37,85,1,100.0,48,48,100.0,False,snapgene,T7 terminator,terminator,transcription terminator for bacteriophage T7 RNA polymerase,CTAGCATAACCCCTTGGGGCCTCTAAACGGGTCTTGAGGGGTTTTTTG
tonB_terminator,1949,1981,1,100.0,32,32,100.0,False,snapgene,tonB terminator,terminator,bidirectional E. coli tonB-P14 transcription terminator,AGTCAAAAGCCTCCGACCGGAGGCTTTTGACT
1,615,720,1,100.0,102,105,97.05882352941177,False,Rfam,RNAI,ncRNA,Accession: RF00106 - RNAI,AGTATTTGGTATCTGCGCTCTGCTGAAGCCAGTTACCTTCGGAAAAAGAGTTGGTAGCTCTTGATCCGGCAAACAAACCACCGCTGGTAGCGGTGGTTTTTTTGT
lacZ_alpha,1932,1949,-1,100.0,174,17,9.770114942528735,True,snapgene,lacZα,CDS,LacZα fragment of β-galactosidase; lacZ fragment,ACTGGCCGTCGTTTTAC
