sseqid,start location,end location,strand,percent identity,full length of feature in db,length of found feature,percent match length,fragment,database,Feature,Type,Description,sequence
AmpR_promoter_(4),1812,1917,-1,100.0,105,105,100.0,False,snapgene,AmpR promoter,promoter,bla,CGCGGAACCCCTATTTGTTTATTTTTCTAAATACATTCAAATATGTATCCGCTCATGAGACAATAACCCTGATAAATGCTTCAATAATATTGAAAAAGGAAGAGT
AmpR_(2),951,1812,-1,99.652,861,861,100.0,False,snapgene,AmpR,CDS,"β-lactamase; bla; confers resistance to ampicillin, carbenicillin, and related antibiotics",ATGAGTATTCAACATTTCCGTGTCGCCCTTATTCCCTTTTTTGCGGCATTTTGCCTTCCTGTTTTTGCTCACCCAGAAACGCTGGTGAAAGTAAAAGATGCTGAAGATCAGTTGGGTGCACGAGTGGGTTACATCGAACTGGATCTCAACAGCGGTAAGATCCTTGAGAGTTTTCGCCCCGAAGAACGTTTTCCAATGATGAGCACTTTTAAAGTTCTGCTATGTGGCGCGGTATTATCCCGTATTGACGCCGGGCAAGAGCAACTCGGTCGCCGCATACACTATTCTCAGAATGACTTGGTTGAGTACTCACCAGTCACAGAAAAGCATCTTACGGATGGCATGACAGTAAGAGAATTATGCAGTGCTGCCATAACCATGAGTGATAACACTGCGGCCAACTTACTTCTGACAACGATCGGAGGACCGAAGGAGCTAACCGCTTTTTTGCACAACATGGGGGATCATGTAACTCGCCTTGATCGTTGGGAACCGGAGCTGAATGAAGCCATACCAAACGACGAGCGTGACACCACGATGCCTGTAGCAATGGCAACAACGTTGCGCAAACTATTAACTGGCGAACTACTTACTCTAGCTTCCCGGCAACAATTAATAGACTGGATGGAGGCGGATAAAGTTGCAGGACCACTTCTGCGCTCGGCCCTTCCGGCTGGCTGGTTTATTGCTGATAAATCTGGAGCCGGTGAGCGTGGTTCTCGCGGTATCATTGCAGCACTGGGGCCAGATGGTAAGCCCTCCCGTATCGTAGTTATCTACACGACGGGGAGTCAGGCAACTATGGATGAACGAAATAGACAGATCGCTGAGATAGGTGCCTCACTGATTAAGCATTGGTAA
ori,172,761,-1,99.83,589,589,100.0,False,snapgene,ori,rep_origin,high-copy-number ColE1/pMB1/pBR322/pUC origin of replication ,TTGAGATCCTTTTTTTCTGCGCGTAATCTGCTGCTTGCAAACAAAAAAACCACCGCTACCAGCGGTGGTTTGTTTGCCGGATCAAGAGCTACCAACTCTTTTTCCGAAGGTAACTGGCTTCAGCAGAGCGCAGATACCAAATACTGTTCTTCTAGTGTAGCCGTAGTTAGGCCACCACTTCAAGAACTCTGTAGCACCGCCTACATACCTCGCTCTGCTAATCCTGTTACCAGTGGCTGCTGCCAGTGGCGATAAGTCGTGTCTTACCGGGTTGGACTCAAGACGATAGTTACCGGATAAGGCGCAGCGGTCGGGCTGAACGGGGGGTTCGTGCACACAGCCCAGCTTGGAGCGAACGACCTACACCGAACTGAGATACCTACAGCGTGAGCTATGAGAAAGCGCCACGCTTCCCGAAGGGAGAAAGGCGGACAGGTATCCGGTAAGCGGCAGGGTCGGAACAGGAGAGCGCACGAGGGAGCTTCCAGGGGGAAACGCCTGGTATCTTTATAGTCCTGTCGGGTTTCGCCACCTCTGACTTGAGCGTCGATTTTTGTGATGCTCGTCAGGGGGGCGGAGCCTATGGAAA
T7_terminator,37,85,1,100.0,48,48,100.0,False,snapgene,T7 terminator,terminator,transcription terminator for bacteriophage T7 RNA polymerase,CTAGCATAACCCCTTGGGGCCTCTAAACGGGTCTTGAGGGGTTTTTTG
P05317,2017,2953,1,76.0,936,936,100.0,False,swissprot,RPP0,CDS,"RLA0_YEAST - Also known as L10E, RPA0, RPL10E, RPLA0. Experimental evidence at protein level: Swiss-Prot protein existence level 1. Component of the ribosome, a large ribonucleoprotein complex responsible for the synthesis of proteins in the cell. The small ribosomal subunit (SSU) binds messenger RNAs (mRNAs) and translates the encoded message by selecting cognate aminoacyl-transfer RNA (tRNA) molecules. The large subunit (LSU) contains the ribosomal catalytic site termed the peptidyl transferase center (PTC), which catalyzes the formation of peptide bonds, thereby polymerizing the amino acids delivered by tRNAs into a polypeptide chain. The nascent polypeptides leave the ribosome through a tunnel in the LSU and interact with protein factors that function in enzymatic processing, targeting, and the membrane insertion of nascent chains at the exit of the ribosomal tunnel. uL10 forms part of the P stalk that participates in recruiting G proteins to the ribosome. From Saccharomyces cerevisiae (strain ATCC 204508 / S288c) (Baker's yeast).",ATGGGAGGTATCAACGAAAAGAAAGCCGAGTACTTTAACAAGCTCAGAGAGCTTTTGGAATCTTACAAGTCCATCTTTATTGTCGGTGTTGACAATGTCTCCTCTCAGCAAATGCACGAGGTCAGACAGACTCTCCGTGGTAAAGCTGTGATTCTTATGGGTAAGAACACCATGGTCAGAAAGGCCTTGAGAGACTTCGTCGAGGAGCTCCCAGTCTTTGAGAAGCTGTTGCCTTTCGTCAGAGGTAACATTGGTTTCGTTTTCACCAACGAGGACTTGAAAACCATCAGAGATGTGATCATCGAGAACAGAGTCGCTGCCCCAGCCAGACCAGGTGCTATCGCTCCTTTGGATGTTTTCATTCCTGCCGGTAACACTGGTATGGAACCAGGTAAGACCTCTTTCTTCCAAGCTCTTGGTGTCCCAACCAAGATTTCCAGAGGTACCATTGAGATCACCAGTGATGTTAAGGTTGTTGAGAAAGACTCCAGAGTTGGTCCTTCCGAGGCTCAATTGTTGAACATGTTGAACATCTCTCCTTTCACCTACGGTTTGACTGTTGTTCAAGTTTTCGACGATGGACAAGTTTTCCCAGCTAACATTTTGGACATCACCGATGACGAGCTGTTGTCTCACTTCACCTCTGCCATCTCTACCATTGCCCAAATCTCTTTGGCTGCTGGTTACCCAACTTTGCCATCCGTTGGTCACTCTGTTGTCAACCACTACAAGAATGTTTTGGCTGTCTCCATTGCTACTGACTACTCCTTTGAGGGTTCTGAAGCTATCAAGGACAGATTGGCTAACCCTGAGGCTTACGCTGCTGCTGCTCCTGCTGCCGGTGAGGCTTCTGCTGGTGCCGAGGAGACTGCTGCCGCTGCTGAGGAGGAGGACGAAGAGTCTGAGGACGACGACATGGGATTCGGTTTGTTTGAT
tonB_terminator,1949,1981,1,100.0,32,32,100.0,False,snapgene,tonB terminator,terminator,bidirectional E. coli tonB-P14 transcription terminator,AGTCAAAAGCCTCCGACCGGAGGCTTTTGACT
1,615,720,1,100.0,102,105,97.05882352941177,False,Rfam,RNAI,ncRNA,Accession: RF00106 - RNAI,AGTATTTGGTATCTGCGCTCTGCTGAAGCCAGTTACCTTCGGAAAAAGAGTTGGTAGCTCTTGATCCGGCAAACAAACCACCGCTGGTAGCGGTGGTTTTTTTGT
lacZ_alpha,1932,1949,-1,100.0,174,17,9.770114942528735,True,snapgene,lacZα,CDS,LacZα fragment of β-galactosidase; lacZ fragment,ACTGGCCGTCGTTTTAC
